{
  "id": "fortify",
  "name": "Fortify",
  "description": "Defense +20% for 3 turns.",
  "kind": "buff",
  "element": null,
  "tickAt": "turnEnd",
  "magnitudeOf": null,
  "percent": null,
  "tickDamageType": null,
  "ignoresDefense": false,
  "stacking": "refresh",
  "maxStacks": 1,
  "durationDefault": 3,
  "endsWhen": null,
  "effects": [
    {
      "kind": "buffStat",
      "stat": "defense",
      "percent": 20
    }
  ],
  "upgradesTo": null,
  "cleansedBy": [
    "strip"
  ],
  "appliesEnergyDelta": 0,
  "skipsActionChance": 0,
  "immunityRoles": [],
  "bossBecomes": null,
  "visual": {
    "icon": "status-fortify",
    "tint": "#b0a060"
  }
}
